{
  "schemaVersion": "rigor.outcome.v1",
  "artifactId": "outcome_EVAL-FEAT-2",
  "taskId": "EVAL-FEAT-2",
  "createdAt": "2023-11-14T22:13:36.000Z",
  "decision": "accepted",
  "acceptedWithoutModelCodeChanges": false,
  "humanCorrectionMinutes": 0,
  "escalationCount": 0,
  "retryCount": 0,
  "reviewFindings": {
    "critical": 0,
    "high": 0,
    "medium": 0,
    "low": 0,
    "total": 0
  },
  "revertStatus": "none",
  "escapedDefectStatus": "confirmed",
  "executionIdentityStatus": "unverified",
  "routingPlanArtifactId": "routing-plan_EVAL-FEAT-2_1",
  "attemptArtifactId": "attempt_EVAL-FEAT-2_1",
  "attemptSequence": 1,
  "attemptStatus": "completed",
  "attemptDurationMs": 200000,
  "provider": "synthetic",
  "model": "synthetic-frontier",
  "capabilityClass": "frontier",
  "verificationArtifactId": "verification_EVAL-FEAT-2",
  "usage": {
    "status": "recorded",
    "inputTokens": 1000,
    "outputTokens": 500,
    "totalTokens": 1500,
    "reasoningEffort": null,
    "providerCost": {
      "currency": "USD",
      "amount": 1.23
    },
    "modelIdentity": {
      "value": "reported-frontier",
      "attestation": "unverified"
    }
  },
  "notes": []
}
