{
  "schemaVersion": "rigor.outcome.v1",
  "artifactId": "outcome_EVAL-FEAT-1",
  "taskId": "EVAL-FEAT-1",
  "createdAt": "2023-11-14T22:13:33.000Z",
  "decision": "accepted",
  "acceptedWithoutModelCodeChanges": false,
  "humanCorrectionMinutes": 45,
  "escalationCount": 1,
  "retryCount": 1,
  "reviewFindings": {
    "critical": 0,
    "high": 1,
    "medium": 0,
    "low": 0,
    "total": 1
  },
  "revertStatus": "none",
  "escapedDefectStatus": "none",
  "executionIdentityStatus": "unverified",
  "routingPlanArtifactId": "routing-plan_EVAL-FEAT-1_2",
  "attemptArtifactId": "attempt_EVAL-FEAT-1_2",
  "attemptSequence": 2,
  "attemptStatus": "completed",
  "attemptDurationMs": 300000,
  "provider": "synthetic",
  "model": "synthetic-premium",
  "capabilityClass": "premium",
  "verificationArtifactId": "verification_EVAL-FEAT-1",
  "usage": {
    "status": "unavailable",
    "inputTokens": null,
    "outputTokens": null,
    "totalTokens": null,
    "reasoningEffort": null,
    "providerCost": null,
    "modelIdentity": null
  },
  "notes": []
}
