{
  "schemaVersion": "rigor.outcome.v1",
  "artifactId": "outcome_EVAL-UNRES-1",
  "taskId": "EVAL-UNRES-1",
  "createdAt": "2023-11-14T22:14:00.000Z",
  "decision": "accepted",
  "acceptedWithoutModelCodeChanges": false,
  "humanCorrectionMinutes": 0,
  "escalationCount": 0,
  "retryCount": 0,
  "reviewFindings": {
    "critical": 0,
    "high": 0,
    "medium": 0,
    "low": 0,
    "total": 0
  },
  "revertStatus": "none",
  "escapedDefectStatus": "none",
  "executionIdentityStatus": "unverified",
  "routingPlanArtifactId": "routing-plan_EVAL-UNRES-1_missing",
  "attemptArtifactId": "attempt_EVAL-UNRES-1_1",
  "attemptSequence": 1,
  "attemptStatus": "completed",
  "attemptDurationMs": 100000,
  "provider": "synthetic",
  "model": "synthetic-standard",
  "capabilityClass": "standard",
  "verificationArtifactId": "verification_EVAL-UNRES-1",
  "usage": {
    "status": "recorded",
    "inputTokens": 1000,
    "outputTokens": 500,
    "totalTokens": 1500,
    "reasoningEffort": null,
    "providerCost": null,
    "modelIdentity": null
  },
  "notes": []
}
