{
  "schemaVersion": "rigor.outcome.v1",
  "artifactId": "outcome_EVAL-DOC-2",
  "taskId": "EVAL-DOC-2",
  "createdAt": "2023-11-14T22:13:47.000Z",
  "decision": "accepted",
  "acceptedWithoutModelCodeChanges": false,
  "humanCorrectionMinutes": 0,
  "escalationCount": 0,
  "retryCount": 0,
  "reviewFindings": {
    "critical": 0,
    "high": 0,
    "medium": 0,
    "low": 0,
    "total": 0
  },
  "revertStatus": "none",
  "escapedDefectStatus": "none",
  "executionIdentityStatus": "unverified",
  "routingPlanArtifactId": "routing-plan_EVAL-DOC-2_1",
  "attemptArtifactId": "attempt_EVAL-DOC-2_1",
  "attemptSequence": 1,
  "attemptStatus": "completed",
  "attemptDurationMs": 40000,
  "provider": "synthetic",
  "model": "synthetic-economy",
  "capabilityClass": "economy",
  "verificationArtifactId": "verification_EVAL-DOC-2",
  "usage": {
    "status": "unavailable",
    "inputTokens": null,
    "outputTokens": null,
    "totalTokens": null,
    "reasoningEffort": null,
    "providerCost": null,
    "modelIdentity": null
  },
  "notes": []
}
